Title,Salary,Responsibilities,Requirements
Data Analyst,"$4,000 ?�? $6,000 per month","['Collect, analyse, and interpret complex data sets to identify trends and patterns', 'Develop and maintain robust data models, reports, and dashboards to provide insights and recommendations to stakeholders', 'Partner with cross-functional teams to understand business requirements and translate them into data solutions', 'Automate data extraction, transformation, and loading processes to improve efficiency', ""Continuously explore new data sources and analytical techniques to enhance the company's data capabilities"", 'Provide training and support to other team members to build data literacy across the organisation']","['Degree in a quantitative field such as Statistics, Mathematics, Computer Science, or a related discipline', '1 years of experience as a Data Analyst or in a similar role, preferably within the Information & Communication Technology industry', 'Strong proficiency in data manipulation, analysis, and visualisation tools such as SQL, Python, and Tableau', 'Excellent problem-solving and critical thinking skills, with the ability to translate complex data into actionable insights', 'Proven track record of collaborating with cross-functional teams and effectively communicating technical information to non-technical stakeholders', 'Familiarity with data warehousing and business intelligence concepts']"
Consumer Insights and Analytics (Data Analytics) Analyst,"$4,000 ?�? $5,500 per month","['Conduct in-depth analysis of operational data to identify trends, patterns, and anomalies', 'Develop data pipelines to automatically clean and store data', 'Query data according to research needs', 'Set benchmarks and identify opportunities to improve operational performance', 'Present key findings from analyses to senior management to inform decision-making', 'Collaborate with data engineers to develop data pipelines and data storage solutions', 'Design data visualisation dashboards in collaboration with colleagues from respective teams', 'Conduct training for dashboard users to ensure effective utilisation', 'Train colleagues outside of the analytics team in data analysis to incorporate data analytics into business decision-making\xa0']","[""Bachelor's Degree in Business Administration, Economics, Engineering, Computing, or Science preferred. Polytechnic Diploma holders as well as candidates with relevant training and experience are welcome to apply"", 'Proficient in Microsoft Office suite, with strong PowerPoint and Excel skills', 'Strong quantitative analysis skills and understanding of data structures', 'Experience with SQL, Python, and/or Power BI is desirable, but training opportunities are available', 'Strong ability to think and communicate in a structured manner', 'Passionate in data visualisation and data storytelling, with strong aesthetic sense', 'Ability to work independently and as part of a team', 'Adaptable and quick learner, eager to grow and develop', 'Attention to detail and a commitment to delivering high-quality work', 'High sense of curiosity and problem-solving drive']"
Data Analyst (Digital Transformation) | Permanent,"$3,500 – $4,500 per month","['The incumbent will support the division in the implementation of Digital Transformation projects to improve service and cost efficiency in the following:', 'Analyst and evaluate operation need and user requirements across Business Unit and departments;\xa0Partner with stakeholders to define data requirements and collect the relevant date', 'Manage project planning, solution and ensure the right implementation of IT solution to meet the operational requirementsPerform statistical analysis, data mining and pattern recognition to uncover trends, correlations, insights and create clear visualizations', 'Project development to improve operational productivity & efficiency by adopting digital transformation tools', 'Manage projects in coordination with the team, adhering to deadlines, aligning to company strategy', 'Provide well-structured data for further analysis &\xa0Other duties as assigned']","['Degree in Information Technology, Computer Science or a related field', 'Experience in Information Technology, development and related', 'Strong knowledge in various digital transformation knowledge & automation tools, such Microsoft Power Platform, SharePoint, PowerBI, MS SQL, Knime, Python, cloud platforms', 'Strong communication and good interpersonal skilk.\xa0Meticulous, organized and resourceful team player &Highly motivated individual who works independently with little supervision']"
Marketing Data Analyst,"$5,000 – $6,200 per month","['Manage content solutions targets, pipelines, budget and ensure dashboard is updated', 'Collaborate with global cross-functional teams to ensure timely reporting and alignment', 'Perform data analysis by monitoring trends and providing actionable insights to drive business growth', 'Support marketing team to improve process and operational efficiency', 'Support marketing team to develop content solution']","['BA/BS degree with 3 years experience in data analysis or digital marketing and media', 'Experience in data operations such as reporting, building dashboards, business intelligence tools and managing datasets', 'Excellent skills in presenting data in MS Office (Excel, Thinkcell), Keynote', 'Demonstrated ability to manage multiple projects under tight deadlines in a fast-paced environment', 'Experience with query languages (SQL, HIVE etc.) is a plus', 'Excellent understanding of digital marketing, especially the mobile, social landscape', 'Fast learner, detail-oriented and open to assist with any task']"
"Senior Executive, Data Analytics (Healthcare | Service Operations)","$4,000 – $5,800 per month","['Identify relevant datasets and work with data teams in the integration and management of data, ensuring data hygiene, quality and accessibility for analysis.', 'Develop and maintain both external and internal dashboards and reports that provide actionable insights.', 'Support stakeholders in review, analysis of key performance indicators and establishing insights to measure and optimise patient experience and care quality', 'Compile, analyse, and provide relevant data to bolster improvement projects and strengthen award applications, ensuring success service stories are effectively showcased and recognised.', 'Participate in Artificial Intelligence (AI), Business Intelligence (BI), and Robotic Process Automation (RPA) projects aimed at enhancing patient experience.', 'Develop a system for knowledge management to document all Service Ops discussions and ensure that the system remains updated and accessible to the relevant stakeholders.']","['Bachelors Degree in Statistics, Business Analytics, Business Administration or equivalent.', '2 years of relevant work experience in data analytics and management.', 'Preferably working experience in healthcare domain, or in clinical setting, with understanding of basic clinical terms, medical standards and jargons.', 'Proficient in Tableau or other analytics tools.', 'Good interpersonal skills, a detail-oriented and flexible person who can work across different areas within the team as well as alignment cross functionally outside the team.', 'Self-motivated, ability to multitask and prioritize projects to meet deadlines.']"
Data Analyst,"$4,500 – $6,500 per month","['Refine time-series statistical modeling forecasting accuracy over an 18 month period with R and Python via Google Cloud Platform', 'Automate business processes by using Phyton to develop machine learning models \xa0', 'Perform analysis on structured and unstructured datasets to pick up trends and patterns', 'Able to dig-in, understand the data, and to use creative thinking and problem-solving skills to design scalable and robust solutions', 'Provide and present complex information using data visualization techniques through dashboards and reporting such as Microsoft Power BI.']","['Bachelors or master’s degree in Statistics or Mathematics', 'Min 2 years’ experience in Python', 'Min 2 years of experience with time series, with a strong understanding and knowledge in time series forecasting; univariate, multivariate, and ensemble modeling.', 'Min 2 years of experience with database technologies (SQL or others) in querying, creating databases, stored procedures, etc', 'At least 1 year of experience in Google Cloud Platform or similar (AWS, Microsoft Azure)', 'Min \xa0years of experience with Microsoft Power BI']"
"Assistant Manager, Data Analyst (REF:GJR)","$6,000 – $7,500 per month","['Provide analytics support functions such as ensuring data requests are attended to on time, are accurate and appropriate.\xa0', 'Help improve the data accuracy and efficiency of the operation, and manpower utilization', 'Analytics duties include data extraction, statistical analysis, predictive analysis, publishing of information on the management dashboards and intranet, and present analysis and findings to management', 'Administration of request routing systems, document and project repositories\xa0', 'Provide data support such as extracting, reviewing and analyzing business information from multiple sources like datamart', 'Present the results and findings to different stakeholders as required', 'Participate in quality improvement projects, research studies, programs involving clinical services and special events', 'Participate in user requirement gatherings or enhancements of institution datamarts', 'Participate in data modelling workshops \xa0', 'Ensure continuity of operations, supervise and coach staff\xa0', 'Management of information/reports presented on the Intranet']","['Degree in Data Analytics, Business or relevant', '5 years’ experience in business analytics in a healthcare setting or equivalent', 'At least 3 years’ experience in supervision', 'Data support in a data warehouse or business intelligence environment would be advantageous', 'Experience in SQL and AWS Sagemaker is required', 'Statistical analysis, predictive analytics, geo-spatial analytics will be advantages', 'Knowledge of operational research, dashboarding tools such as tableau is a bonus']"
Software Engineer,"$4,500 – $6,750 per month","['Designs and implements systems using a variety of languages (e.g. C, C++, C#, Java, etc.);', 'Designs enhancements, updates, and programming changes for subsystems, including embedded code;', 'Writes and executes complete testing plans, protocols, and documentation;', 'Identifies and debugs, and creates solutions for issues with code and integration into application architecture;', 'Collaborates and communicates with management, internal, and outsourced development partners regarding firmware design status, project progress, and issue resolution; and', 'Analyzes designs to determine coding, programming, and integration activities required based on general objectives and knowledge of overall architecture of product or solution.']","['Degree in Computer Science or Embedded System.', 'Proficiency and experience in C, C++, C#, Java, UML, Docker.', 'Good knowledge in application software programing for Linux and Windows.', 'Knowledge and experience with network programming and database programming.', 'Familiar with C#.Net full stack development.', 'Knowledge about containerized microservice solution.', 'Knowledge about aws/azure cloud architecture.', 'SIngaporean preferred']"
Software Engineer,"$3,800 – $4,500 per month","['Design and develop software or GUI for automated equipment based on specification and requirements', 'Write design documentation to communicate functions of the developed programs', 'Maintain, review and improve legacy codes and features', 'Liaise with customer on control requirement and commissioning of the software in customer site']","['Degree / Diploma in Electrical / Electronic Engineering/ Computer science or related discipline', 'Preferably with 2 – 3 years of experience in PC Programming (e.g. Visual C#)', 'Familiar with various motions system or automation devices (e.g. IAI, Yasakawa)', 'Familiar with vision systems (e.g. Cognex)', 'Preferable with PLC Knowledge (e.g. Omron/Beckhoff)', 'Must be a self-starter, team player, work well with others and have positive attitude', 'Creative thinker, results orientated, focused and attentive to details & accuracy', 'Able to travel overseas at short notice']"
Software Engineer,"$3,500 – $5,000 per month","['Responsible for software prototyping, design, develop, test and integration of software solutions for various projects', 'Perform requirement analysis, design, development, test, system integration and site integration for developed applications', 'Provide technical, deployment and commissioning sypport to Project Teams and Customers', 'Maintain and enhance software applications in both functionality\xa0', 'Provide software wupport via on-site troubleshooting, testing andtuning of applications, software, network, protocols and communications issues']","['Diploma/Degree in Computer Science or Electronics Engineering', 'Experienced in to or more languages such as C/C++, C#, HTML5 and Unix shell or othere scripting languages', 'Experienced in at least one scripting languages such as Python, Bash or Typescript', 'Experienced in designing and optimizing relational databases using MS SQL, MySQL or PostgreSQL', 'At least 1 year experience with at least 1 fuSDLC', 'Knowledge or Experience with REST, Map Engines, SCADA and/or RSBMS are desired']"
Software Developer,"$3,500 – $5,000 per month","['Project Collaboration: Work with project managers and stakeholders to plan and execute development tasks.', 'Software Development: Develop, deploy, and maintain robust clinic software, web services, and APIs.', 'Innovation & Efficiency: Continuously improve patient care and operational processes at both headquarters and clinic levels.', 'Application Support: Tackle challenges from basic troubleshooting to complex technical issues.', 'Performance Tuning: Propose strategies to optimize performance and scalability.', 'Documentation: Produce technical specs, user manuals, and maintenance guides to support development and operational continuity.', 'Agile Methodologies: Adapt to changing priorities, meet project timelines, and communicate effectively within an agile environment.', 'Quality Focus: Embrace clean coding practices, rigorous testing, and a mindset of continuous learning.']","['Educational Background: Bachelor’s Degree in Computer Science, Engineering, or related fields.', 'Technical Fundamentals: Basic understanding of Object-Oriented Programming. Experience (or coursework) with ASP.NET, Entity Framework, MVC, C#, VB.NET, JavaScript, AJAX is a plus.', 'Web Development: Familiarity with HTML, CSS, responsive design, and cross-browser/device compatibility is advantageous.', 'Database Knowledge: Comfortable with SQL.', 'Support Availability: Willingness to provide systems support during clinic operational hours.']"
Python Imaging Software Developer,"$4,700 – $7,000 per month","['Develop and maintain image processing applications using Python.', 'Utilize Pillow (PIL) for image filtering, transformation, and enhancement.', 'Implement computer vision solutions using OpenCV for object detection, recognition, and segmentation.', 'Design and develop Flask-based web applications for image processing services and APIs.', 'Handle data manipulation and analysis using Pandas and NumPy.', 'Build and enhance GUI applications using Tkinter for user-friendly imaging tools.', 'Optimize performance for large-scale image processing applications.', 'Debug, troubleshoot, and improve the reliability of imaging-related software.', 'Collaborate with data scientists and software engineers to develop innovative imaging solutions.', 'Write clean, efficient, and well-documented code.']","['Bachelor’s degree in Computer Science, Engineering, or a related field.', '3+ years of experience in Python programming, focusing on imaging applications.', 'Proficiency in Flask for developing web-based image processing tools.', 'Strong experience with Pillow (PIL) and OpenCV for image manipulation and computer vision.', 'Good knowledge of Pandas and NumPy for data processing and numerical computations.', 'Hands-on experience in developing Tkinter-based desktop applications.', 'Strong debugging and optimization skills.', 'Ability to work both independently and collaboratively in a team environment.', 'Excellent problem-solving and communication skills.']"
Senior Software Developer (Backend/GoLang),"$6,800 – $10,000 per month","['Responsible for backend application development, code quality, and progress, as well as completing code writing efficiently and with high quality according to work arrangements to ensure compliance with front-end code specifications.', 'Develop APIs for seamless communication between Front-end and Back-end applications', 'Complete the implementation of the software system code, write code comments and development documents;', 'Challenging programming and software design problems', 'Provide support for critical application problems and issues', 'Provide operational support for web systems and application platforms', 'Assist in the function definition and program design of the system;', 'Analyze and solve problems in the software development process;', ""Analyze users' needs and design software"", 'Promote software design/testing/coding best practices', 'Demonstrate great maturity and skill in software design and development practice', 'Work closely with stakeholder teams for constant review of product design, operation, and maintenance.']","[""Bachelor's degree or above, major in computer, communication, mathematics, etc.;"", 'More than four years of backend development experience with Golang.', 'Able to work, troubleshoot, and resolve problems independently.', 'Familiarity with web application development (HTTP, security, database, message queue etc).', 'Proficiency in MySQL database design and performance optimization.', 'Proficiency in Redis, MongoDB, Memcached, etc will be a plus point.', 'Basic knowledge of JS, and Ajax.\xa0', 'Understand the separation architecture between the Front-end and the Back-end.', 'Understand the common commands of Linux / Unix systems.', 'Knowledge of container technologies such as Docker, Kubernetes, etc.', 'Good data structure and algorithm foundation, solid programming skills;', 'Possess demand analysis and system design capabilities, as well as strong logical analysis and independent problem-solving capabilities;', 'Positive and optimistic, strong sense of responsibility, serious and meticulous work, good team communication and collaboration skills;', 'Only Singaporeans/SPRs need to apply']"
Software Engineer,"$3,500 – $5,000 per month","['Responsible for software prototyping, design, develop, test and integration of software solutions for various projects', 'Perform requirement analysis, design, development, test, system integration and site integration for developed applications', 'Provide technical, deployment and commissioning sypport to Project Teams and Customers', 'Maintain and enhance software applications in both functionality\xa0', 'Provide software wupport via on-site troubleshooting, testing andtuning of applications, software, network, protocols and communications issues']","['Diploma/Degree in Computer Science or Electronics Engineering', 'Experienced in to or more languages such as C/C++, C#, HTML5 and Unix shell or othere scripting languages', 'Experienced in at least one scripting languages such as Python, Bash or Typescript', 'Experienced in designing and optimizing relational databases using MS SQL, MySQL or PostgreSQL', 'At least 1 year experience with at least 1 fuSDLC', 'Knowledge or Experience with REST, Map Engines, SCADA and/or RSBMS are desired']"
PHP software developer,"$3,500 – $5,000 per month","['Develop feasible web application / system accordingly to requirements, troubleshooting and debugging when requested.', 'Design backend database structures for the web applications.', 'Writing high quality, clean and concise codebase that is highly efficient, scalable, easily portable, and maintainable.', 'Test systems on different web browsers and platforms to ensure a quality user experience for the clients.', 'Software design and optimization, able to provide technical advice & solution to improve software quality, research and development to bring system/software product to the next level.', 'Document and maintain knowledge through code, code comments, diagrams, flowcharts, layouts, and other technical documentation in written form for the purpose of knowledge retention and transfer.']","['At least a Diploma/Degree in Information Technology / Computer Science or relevant field.', 'Required skills for PHP programmer: Laravel\xa0/Lumen/ CodeIgniter framework', 'Proficiency in REST API, SOAP, JSON, etc.', 'Knowledge of MySQL database to ensure strong optimization and functionality.', 'Strong logic thinking, analytical skills and good problem-solving skill.', 'Able to work as a team player to achieve the assigned task within the deadline.', 'Matured personality and able to work independently as well as in a team with a can-do working attitude.', 'Preferably 2 years of working experience in the related field', 'Experience in AI, Microservices Architecture, System Security, AWS server gives an advantage.']"
Web Developer,"$2,500 – $3,200 per month","['Develop & Maintain: Build responsive, efficient, and scalable web applications using modern JavaScript frameworks.', 'Testing and debugging: Identifying and fixing errors in code to ensure website functionality across different browsers and devices.', 'Collaborate: Work closely with cross-functional teams—including designers, product managers, and other developers—to create seamless digital experiences.', 'Optimize: Ensure optimal performance, speed, and scalability of websites and applications.', 'Code Quality: Write clean, well-documented code and participate in code reviews to maintain high-quality standards.', 'UX/UI Integration: Incorporate basic UX/UI principles into designs to improve user engagement and satisfaction.', 'Stay Updated: Keep current with emerging technologies and best practices in web development and design.']","['Experience: Minimum of 2 years of professional web development experience.', 'Technical Skills:Proficiency in JavaScript and experience with at least one modern JavaScript framework (e.g., React, Angular, Vue).Strong understanding of HTML5, CSS3, and responsive design techniques.', 'Proficiency in JavaScript and experience with at least one modern JavaScript framework (e.g., React, Angular, Vue).', 'Strong understanding of HTML5, CSS3, and responsive design techniques.', 'UX/UI Knowledge: Basic understanding of UX/UI design principles to ensure user-friendly and visually appealing applications.', 'Tools: Familiarity with version control systems (e.g., Git) and agile development methodologies.', 'Problem-Solving: Excellent analytical and troubleshooting skills with a keen attention to detail.', 'Education: Min Diploma in Computer Science or IT preferred.']"
Software Developer (Kotlin / Java / Agile),"$4,000 – $6,000 per month","['Software Development Exp', 'Kotlin / Java Exp', 'CBD']","['Work in the Agile team and to develop / maintain functionalities to support the Group’s Payment eco-system and legacy applications', 'Participate in activities including design, tasks estimation, development, unit testing, releases and production support', 'Improve code quality and perform code reviews', 'Develop / Maintain automated unit test scripts, perform unit testing and validation of requirements with BA / users / stakeholders', 'Perform investigation / troubleshooting of issues raised on mobile application / microservices / applications', 'Keep abreast with new technologies', 'Provide training to end users and documentation to support knowledge transfer', 'Develop Proof-of-Concept for new ideation or initiatives', 'Identify areas of improvement, improve development efficiency and application quality', 'Conduct and lead code review session', 'Any other ad-hoc task as assigned']"
"Software Developer (React Native, Typescript)","$4,500 – $6,500 per month","['Which of the following statements best describes your right to work in Singapore?', ""What's your expected monthly basic salary?"", 'Which of the following types of qualifications do you have?', ""How many years' experience do you have as a Software Developer?"", 'Which of the following programming languages are you experienced in?', 'Do you have experience working within a scrum agile team?', 'How many years of Android development experience do you have?', ""How many years' experience do you have in a software development role?""]","['Job search', 'Profile', 'Recommended jobs', 'Saved searches', 'Saved jobs', 'Job applications', 'Career advice', 'Explore careers', 'Explore salaries', 'Explore companies', 'Community', 'Download appsJobstreet @ Google PlayJobstreet @ App Store', 'Jobstreet @ Google Play', 'Jobstreet @ App Store']"
