Title,Salary,Responsibilities,Requirements
"Software Developer (Node JS, Java & Mongo DB) |$ 5500 | Immediate Hiring!","$4,500 – $5,500 per month","['Participate in AGILE project methodologies, working in SCRUM sprints, and attending daily stand-ups.', 'Design, code, test, and document software applications and API solutions to meet business requirements.', 'Collaborate with customers for requirement gathering, acceptance testing, and troubleshooting issues.', 'Develop secure, scalable, and high-quality application programs and APIs.', 'Perform data migration, data transformation, and scripting tasks as needed.', 'Participate in continuous integration (CI) and DevSecOps practices for testing and deployment.']","['Bachelor’s degree in computer science, IT, or a related field, or equivalent professional experience.', 'Minimum of 3+ years of experience in systems implementation and software development lifecycle processes.', 'Proficient in modern web technologies including Node.js, React, TypeScript, Java Spring Boot, and MongoDB, with experience in web application development using these technologies.\xa0', 'Excellent team player with strong communication and interpersonal skills.']"
"Data Engineer - Python, ETL (Up to $6k/Central) (ID: 667943)","$5,000 – $6,500 per month","['Design, develop, and maintain ETL/ELT pipelines, API endpoints, and data applications across both cloud (Microsoft Azure) and on-premise environments, integrating internal and external data sources, including web scraping of public data (with a focus on ensuring compliance).', 'Continuously monitor, optimize, and maintain data quality, performance, and availability through data cleansing, transformation, and the deployment of scalable solutions.', 'Create and optimize interactive dashboards to visualize key business metrics, working closely with stakeholders to design intuitive user interfaces and integrate them with backend data pipelines.', 'Implement CI/CD pipelines, automate deployments, and ensure the scalability and performance of data and Machine Learning (ML)/AI solutions.', 'Collaborate with Data Scientists and software engineers to deploy, monitor, and maintain ML/AI projects within production systems.']","['Proficiency in relational databases (MS SQL Server), NoSQL, and ETL pipelines using Python or ETL tools (e.g., Microsoft SSIS, Informatica IPC).', 'Familiarity with Python web application and API development tools (e.g., Flask, Requests) and web scraping tools (e.g., BeautifulSoup, Scrapy).', 'Expertise in Power BI, including DAX and Power Query, for creating reports and dashboards.', 'Experience with Microsoft Azure PaaS services, including Azure Data Factory, Data Lake Storage, App Service, and Azure SQL, along with CI/CD pipelines using Azure DevOps.', 'Knowledge of Machine Learning tools (e.g., AutoML platforms like Azure AutoML or DataRobot) and ML libraries (e.g., Scikit-learn, TensorFlow, PyTorch, Keras).', 'Familiarity with big data technologies (e.g., Hadoop, Hive, Spark) and the Databricks platform (a plus).']"
"Data Engineer - Python, ETL (Up to $6k/Central) (ID: 667943)","$5,000 – $6,500 per month","['Design, develop, and maintain ETL/ELT pipelines, API endpoints, and data applications across both cloud (Microsoft Azure) and on-premise environments, integrating internal and external data sources, including web scraping of public data (with a focus on ensuring compliance).', 'Continuously monitor, optimize, and maintain data quality, performance, and availability through data cleansing, transformation, and the deployment of scalable solutions.', 'Create and optimize interactive dashboards to visualize key business metrics, working closely with stakeholders to design intuitive user interfaces and integrate them with backend data pipelines.', 'Implement CI/CD pipelines, automate deployments, and ensure the scalability and performance of data and Machine Learning (ML)/AI solutions.', 'Collaborate with Data Scientists and software engineers to deploy, monitor, and maintain ML/AI projects within production systems.']","['Proficiency in relational databases (MS SQL Server), NoSQL, and ETL pipelines using Python or ETL tools (e.g., Microsoft SSIS, Informatica IPC).', 'Familiarity with Python web application and API development tools (e.g., Flask, Requests) and web scraping tools (e.g., BeautifulSoup, Scrapy).', 'Expertise in Power BI, including DAX and Power Query, for creating reports and dashboards.', 'Experience with Microsoft Azure PaaS services, including Azure Data Factory, Data Lake Storage, App Service, and Azure SQL, along with CI/CD pipelines using Azure DevOps.', 'Knowledge of Machine Learning tools (e.g., AutoML platforms like Azure AutoML or DataRobot) and ML libraries (e.g., Scikit-learn, TensorFlow, PyTorch, Keras).', 'Familiarity with big data technologies (e.g., Hadoop, Hive, Spark) and the Databricks platform (a plus).']"
"Data Engineer - Python, ETL (Up to $6k/Central) (ID: 667943)","$5,000 – $6,500 per month","['Design, develop, and maintain ETL/ELT pipelines, API endpoints, and data applications across both cloud (Microsoft Azure) and on-premise environments, integrating internal and external data sources, including web scraping of public data (with a focus on ensuring compliance).', 'Continuously monitor, optimize, and maintain data quality, performance, and availability through data cleansing, transformation, and the deployment of scalable solutions.', 'Create and optimize interactive dashboards to visualize key business metrics, working closely with stakeholders to design intuitive user interfaces and integrate them with backend data pipelines.', 'Implement CI/CD pipelines, automate deployments, and ensure the scalability and performance of data and Machine Learning (ML)/AI solutions.', 'Collaborate with Data Scientists and software engineers to deploy, monitor, and maintain ML/AI projects within production systems.']","['Proficiency in relational databases (MS SQL Server), NoSQL, and ETL pipelines using Python or ETL tools (e.g., Microsoft SSIS, Informatica IPC).', 'Familiarity with Python web application and API development tools (e.g., Flask, Requests) and web scraping tools (e.g., BeautifulSoup, Scrapy).', 'Expertise in Power BI, including DAX and Power Query, for creating reports and dashboards.', 'Experience with Microsoft Azure PaaS services, including Azure Data Factory, Data Lake Storage, App Service, and Azure SQL, along with CI/CD pipelines using Azure DevOps.', 'Knowledge of Machine Learning tools (e.g., AutoML platforms like Azure AutoML or DataRobot) and ML libraries (e.g., Scikit-learn, TensorFlow, PyTorch, Keras).', 'Familiarity with big data technologies (e.g., Hadoop, Hive, Spark) and the Databricks platform (a plus).']"
"Data Engineer - Python, ETL (Up to $6k/Central) (ID: 667943)","$5,000 – $6,500 per month","['Design, develop, and maintain ETL/ELT pipelines, API endpoints, and data applications across both cloud (Microsoft Azure) and on-premise environments, integrating internal and external data sources, including web scraping of public data (with a focus on ensuring compliance).', 'Continuously monitor, optimize, and maintain data quality, performance, and availability through data cleansing, transformation, and the deployment of scalable solutions.', 'Create and optimize interactive dashboards to visualize key business metrics, working closely with stakeholders to design intuitive user interfaces and integrate them with backend data pipelines.', 'Implement CI/CD pipelines, automate deployments, and ensure the scalability and performance of data and Machine Learning (ML)/AI solutions.', 'Collaborate with Data Scientists and software engineers to deploy, monitor, and maintain ML/AI projects within production systems.']","['Proficiency in relational databases (MS SQL Server), NoSQL, and ETL pipelines using Python or ETL tools (e.g., Microsoft SSIS, Informatica IPC).', 'Familiarity with Python web application and API development tools (e.g., Flask, Requests) and web scraping tools (e.g., BeautifulSoup, Scrapy).', 'Expertise in Power BI, including DAX and Power Query, for creating reports and dashboards.', 'Experience with Microsoft Azure PaaS services, including Azure Data Factory, Data Lake Storage, App Service, and Azure SQL, along with CI/CD pipelines using Azure DevOps.', 'Knowledge of Machine Learning tools (e.g., AutoML platforms like Azure AutoML or DataRobot) and ML libraries (e.g., Scikit-learn, TensorFlow, PyTorch, Keras).', 'Familiarity with big data technologies (e.g., Hadoop, Hive, Spark) and the Databricks platform (a plus).']"
Data Scientist,"$3,500 – $5,000 per month","['Which of the following statements best describes your right to work in Singapore?', ""What's your expected monthly basic salary?""]","['Job search', 'Profile', 'Recommended jobs', 'Saved searches', 'Saved jobs', 'Job applications', 'Career advice', 'Explore careers', 'Explore salaries', 'Explore companies', 'Community', 'Download appsJobstreet @ Google PlayJobstreet @ App Store', 'Jobstreet @ Google Play', 'Jobstreet @ App Store']"
Data Scientist,"$5,500 – $7,000 per month","['Analyze data and use statistical models and machine learning to resolve customer issues and identify root causes.', 'Work with field engineering teams to analyze data from plasma etching systems and provide accurate, timely insights for improvements.', 'Communicate data findings clearly to customers and internal teams.', 'Develop advanced statistical and machine learning algorithms to extract insights from complex data and collaborate with engineering teams to assess algorithm effectiveness.', 'Collaborate with global data engineering teams to share best practices and support cross-functional projects requiring data science expertise.', 'Maintain and develop internal analytics solutions, ensuring data accuracy and integrity.', 'Train local engineers in data analytics tools like JMP/KNIME.', 'Perform additional duties as needed.']","['Degree/Master’s in Microelectronics, Data Science, or a related field.', 'At least 3 years of experience in semiconductor manufacturing, semiconductor fabrication, or related industries.', 'Proven experience as a Data Scientist in the semiconductor industry, with a focus on plasma dry etch processes.', 'Strong ability to develop and implement algorithms for process optimization and problem-solving.', 'Expertise in data analytics, statistical analysis, machine learning techniques, and predictive modeling.', 'Proficiency in data science tools and programming (e.g., Python, JSL, R) for data manipulation, visualization, and analysis.', 'Excellent communication skills and the ability to collaborate in team environments while maintaining good customer relationships.', 'Detail-oriented, organized, and a resourceful team player.', 'Highly motivated and able to work independently with minimal supervision.']"
Data Engineer (Big Data),"$5,000 – $7,000 per month","['Oversee the daily operations of the big data platform, ensuring stability, reliability, and high availability.\xa0', 'Continuously monitor system performance, detect potential issues, and take proactive measures to resolve them.\xa0', 'Manage system configurations, software updates, and patches to maintain platform security and efficiency.\xa0', 'Develop automation scripts using Bash, Python, or Shell to improve operational consistency and reduce manual tasks.']","['Hands-on experience managing Cloudera Data Platform, including components such as HDFS, YARN, HIVE, Spark, Impala, Ranger, and security protocols.\xa0', 'Proficiency in using monitoring tools like Cloudera Manager, Zabbix, Grafana, Splunk, and SyslogNG.\xa0', 'Strong scripting skills in Bash, Python, or Shell to automate tasks and enhance system operations.']"
"Lead Data Engineer, Urgent!  (ETL / Java / CBD / Up 10K + Bonus)","$8,000 – $10,000 per month","['Lead the design, development, and implementation of scalable and efficient data pipelines, databases, and overall data infrastructure.', 'Mentor and guide a team of data engineers, offering technical leadership and support to foster their growth and ensure high performance.', 'Collaborate with data scientists, product managers, and business stakeholders to gather data requirements, promote data-driven decision-making, and deliver actionable insights.', 'Optimize database structures, schemas, tables, and queries to improve data storage, retrieval, and analytical processes.', 'Integrate and enhance analytical tools like Tableau, Power BI, or Looker to support advanced data analysis, visualization, and reporting.', 'Establish and enforce data engineering best practices, standards, and guidelines to maintain high-quality, reliable, and high-performing data solutions.', 'Develop and manage ETL processes to integrate data from diverse sources, ensuring consistency, integrity, and quality.', 'Optimize data pipelines, queries, and infrastructure for better performance, scalability, and cost-effectiveness.', 'Monitor, troubleshoot, and resolve issues in data pipelines and infrastructure to ensure smooth operation and quick resolution.', 'Stay informed about the latest advancements in data engineering technologies, analytical tools, and best practices, driving their adoption within the team.', 'Ensure compliance with data security, governance, and privacy regulations, and ensure adherence to licensing agreements for analytical tools.', 'Work closely with cross-functional teams to identify data requirements and deliver data solutions that align with business objectives.', 'Document data pipelines, processes, and best practices and contribute to the development of comprehensive data engineering documentation and standards.', ""Continuously monitor the latest technologies and best practices in data engineering, recommending their adoption where appropriate to enhance the team's capabilities.""]","['Bachelor’s degree in Computer Science, Information Systems, or a related field, or equivalent work experience.', '6+ years of experience in data engineering, with at least 3 years in a leadership or senior engineering role.', 'Demonstrated leadership skills with experience in mentoring, coaching, and guiding a team of data engineers.', 'Strong technical expertise in designing and implementing data pipelines, databases, and analytical tools.', 'Proficiency in programming languages commonly used in data engineering, such as Python and Java.', 'Hands-on experience with big data technologies and frameworks, including Hadoop, Spark, Kafka, and Hive.', 'Experience with analytical tools like Tableau, Power BI, Looker, or other similar platforms.', 'In-depth knowledge of relational and NoSQL databases, along with experience in database design, optimization, and SQL querying.', 'Experience working with cloud platforms (e.g., AWS, Azure, GCP) and data warehousing solutions such as Snowflake, Redshift, or BigQuery.', 'Experience in real-time data processing and streaming technologies, such as Apache Flink or Kafka Streams.', 'Strong analytical and problem-solving skills, with the ability to predict and evaluate the outcomes of solutions.', 'Excellent communication and collaboration abilities, with experience working effectively in cross-functional teams.', 'Strong sense of responsibility and initiative, demonstrating commitment to goals and deadlines.', 'Self-motivated, proactive, and capable of working independently with minimal supervision.', 'Familiarity with data governance, data security, and compliance standards and best practices.', 'Maintain confidentiality of sensitive information and data.', 'Ability to lead, inspire, and motivate team members in a dynamic, fast-paced environment.', 'Willingness to travel for meetings and collaboration with offshore team members as needed.']"
